{
  "_comment": [
    "Embedded-theme example: the diagram names a built-in theme via the",
    "top-level 'theme' key. No sidecar theme.json needed.",
    "",
    "Equivalent CLI form:  python scripts/mmpviz.py -d diagram.json -t plantuml -o out.svg",
    "",
    "Intended use: Kroki-style HTTP rendering, where a stateless server renders",
    "a single POSTed JSON body without access to sibling files."
  ],
  "title": "Embedded Theme — Built-in Reference",
  "theme": "plantuml",
  "views": [
    {
      "id": "soc",
      "title": "SoC Memory Map",
      "sections": [
        { "id": "flash",    "address": "0x00000000", "size": "0x00100000", "name": "Flash (1 MiB)" },
        { "id": "gap1",     "address": "0x00100000", "size": "0x1FF00000", "name": "···", "flags": ["break"] },
        { "id": "sram",     "address": "0x20000000", "size": "0x00040000", "name": "SRAM (256 KiB)" },
        { "id": "gap2",     "address": "0x20040000", "size": "0x1FFC0000", "name": "···", "flags": ["break"] },
        { "id": "periph",   "address": "0x40000000", "size": "0x10000000", "name": "Peripherals" },
        { "id": "reserved", "address": "0x50000000", "size": "0xB0000000", "name": "Reserved" }
      ]
    }
  ]
}
